{
  "$schema": "../../schema/chapter.schema.json",
  "id": "cumber-n",
  "title": "Nonborn – Cumber",
  "reborn": 0,
  "races": [
    7
  ],
  "sourceCredit": {
    "author": "Naruto"
  },
  "sections": [
    {
      "locId": 1102,
      "quests": [
        {
          "slug": "cumber-n/1102/dziwna-energia",
          "name": "Dziwna Energia",
          "kind": "main",
          "steps": [
            {
              "requirements": [
                "Pokonać w pojedynku: Ojciec"
              ],
              "rewards": [
                "25 do wszystkich statystyk"
              ]
            },
            {
              "requirements": [
                "Opanować: Podstawy panowania nad energią"
              ],
              "rewards": [
                "150 doświadczenia"
              ]
            },
            {
              "requirements": [
                "Zbierz zasób Księga 0/5"
              ],
              "rewards": [
                "300 doświadczenia"
              ]
            },
            {
              "requirements": [
                "Pokonaj: Kukła treningowa(Normal) 0/200",
                "Pokonaj: Kukła treningowa(Champion) 0/400",
                "Pokonaj: Kukła treningowa(Elita) 0/100",
                "Zaczekać 00:01:00"
              ],
              "rewards": [
                "3x Zielone senzu, Podróż do Planeta Sadal z innej lini czasowej – Dziedziniec"
              ]
            }
          ]
        },
        {
          "slug": "cumber-n/1102/wzmocnienie",
          "name": "Wzmocnienie",
          "kind": "side",
          "steps": [
            {
              "requirements": [
                "Wytrenuj Siła 0/100"
              ],
              "rewards": [
                "250 do max PA"
              ]
            },
            {
              "requirements": [
                "Wytrenuj Szybkość 0/100"
              ],
              "rewards": [
                "250 do max PA"
              ]
            }
          ]
        },
        {
          "slug": "cumber-n/1102/trening-walki",
          "name": "Trening walki",
          "kind": "side",
          "steps": [
            {
              "requirements": [
                "Pokonać w pojedynku: Buwavu"
              ],
              "rewards": [
                "Tajemna Skrzynia V"
              ]
            },
            {
              "requirements": [
                "Pokonaj: Kukła treningowa(Normal) 0/400"
              ],
              "rewards": [
                "1x Zielone senzu"
              ]
            },
            {
              "requirements": [
                "Pokonaj: Kukła treningowa(Champion) 0/800"
              ],
              "rewards": [
                "1x Zielone senzu"
              ]
            },
            {
              "requirements": [
                "Spędzone godziny na treningu 0/1",
                "Wpisane kody treningowe 0/1",
                "Pokonać w pojedynku: Buwavu"
              ],
              "rewards": [
                "2x Żółte senzu"
              ]
            }
          ]
        }
      ]
    },
    {
      "locId": 1103,
      "quests": [
        {
          "slug": "cumber-n/1103/dziwna-energia",
          "name": "Dziwna Energia",
          "kind": "main",
          "steps": [
            {
              "requirements": [
                "Zaczekać 00:01:00",
                "Zaczekać 00:02:00"
              ],
              "rewards": [
                "Podróż do Planeta Sadal z innej lini czasowej – Las"
              ]
            }
          ]
        },
        {
          "slug": "cumber-n/1103/krolewska-straz",
          "name": "Królewska straż",
          "kind": "side",
          "steps": [
            {
              "requirements": [
                "Pokonać w pojedynku: Strażnik"
              ],
              "rewards": [
                "2 000 doświadczenia"
              ]
            },
            {
              "requirements": [
                "Zdobyte Niebieskie Senzu 0/100"
              ],
              "rewards": [
                "1000x Niebieskie senzu"
              ]
            },
            {
              "requirements": [
                "Oddaj przedmiot Niebieskie Senzu 100"
              ],
              "rewards": [
                "20 do przyrostu PA"
              ]
            }
          ]
        },
        {
          "slug": "cumber-n/1103/krolewska-straz-ii",
          "name": "Królewska Straż II",
          "kind": "side",
          "requires": [
            "cumber-n/1103/krolewska-straz"
          ],
          "steps": [
            {
              "requirements": [
                "Wykonać zadanie: Królewska straż",
                "Spędzone godziny na treningu 0/4"
              ],
              "rewards": [
                "Technika: Kikoha"
              ]
            }
          ]
        }
      ]
    },
    {
      "locId": 1104,
      "quests": [
        {
          "slug": "cumber-n/1104/dziwna-energia",
          "name": "Dziwna Energia",
          "kind": "main",
          "steps": [
            {
              "requirements": [
                "Pokonaj: Dzika bestia(Normal) 0/200"
              ],
              "rewards": [
                "Bonus premium na 14 dni: Super Wojownik"
              ]
            },
            {
              "requirements": [
                "Pokonaj: Dzika bestia(Champion) 0/400"
              ],
              "rewards": [
                "Bonus premium na 14 dni: Magnetyzm"
              ]
            },
            {
              "requirements": [
                "Pokonaj: Dzika bestia(Elita) 0/600"
              ],
              "rewards": [
                "Bonus premium na 14 dni: Elitarny łowca"
              ]
            },
            {
              "requirements": [
                "Wykonaj akcję [klawisz H] 0/1 000",
                "Zaczekać 00:02:00 –"
              ],
              "rewards": [
                "Podróż do Zamek królewski Króla Sadali"
              ]
            }
          ]
        },
        {
          "slug": "cumber-n/1104/zywnosc",
          "name": "Żywność",
          "kind": "side",
          "steps": [
            {
              "requirements": [
                "Zbierz zasób Jedzenie 0/6"
              ],
              "rewards": [
                "2x Paczka kowala"
              ]
            },
            {
              "requirements": [
                "Zbierz zasób Jedzenie 0/12"
              ],
              "rewards": [
                "20x Karty Dusz, Scouter Doskonałości"
              ]
            }
          ]
        }
      ]
    },
    {
      "locId": 1105,
      "quests": [
        {
          "slug": "cumber-n/1105/dziwna-energia",
          "name": "Dziwna Energia",
          "kind": "main",
          "steps": [
            {
              "requirements": [
                "Zbierz zasób Klucz 0/4"
              ],
              "rewards": [
                "50% bazowego PA zostaje odnowione"
              ]
            },
            {
              "requirements": [
                "Wykonaj akcję [klawisz H] 0/1 000"
              ],
              "rewards": [
                "Podróż do Sala Tronowa"
              ]
            },
            {
              "requirements": [
                "Wykonaj akcję [klawisz H] 0/500",
                "Zaczekać 00:03:00"
              ],
              "rewards": [
                "Podróż do Lądowisko planety sadali"
              ]
            },
            {
              "requirements": [
                "Opanować: Podróżowanie w kosmosie"
              ],
              "rewards": [
                "Podróż do Planeta Yardrat z innej lini czasowej"
              ]
            }
          ]
        },
        {
          "slug": "cumber-n/1105/podstawowy-trening-bojowy",
          "name": "Podstawowy Trening Bojowy",
          "kind": "side",
          "steps": [
            {
              "requirements": [
                "Pokonaj: Strażnik króla(Normal) 0/100"
              ],
              "rewards": [
                "15x Potęga Chi"
              ]
            },
            {
              "requirements": [
                "Pokonaj: Strażnik króla(Champion) 0/400"
              ],
              "rewards": [
                "15x Czystość Chi"
              ]
            },
            {
              "requirements": [
                "Pokonaj: Strażnik króla(Elita) 0/200"
              ],
              "rewards": [
                "2x Czerwone senzu"
              ]
            }
          ]
        },
        {
          "slug": "cumber-n/1105/sztuka-cierpliwosci",
          "name": "Sztuka cierpliwości",
          "kind": "side",
          "steps": [
            {
              "requirements": [
                "Zaczekać 00:10:00",
                "Zaczekać 00:15:00",
                "Wpisane kody treningowe 0/2"
              ],
              "rewards": [
                "Wyciągi z Magicznych Senzu"
              ]
            }
          ]
        },
        {
          "slug": "cumber-n/1105/przetrwanie-w-kosmosie",
          "name": "Przetrwanie w kosmosie",
          "kind": "side",
          "steps": [
            {
              "requirements": [
                "Zdobyć Części od Robot astro mechaniczny (Normal) 0/100"
              ],
              "rewards": [
                "5 kk"
              ]
            },
            {
              "requirements": [
                "Zdobyć Zaawansowane części od Robot astro mechaniczny (Champion) 0/500"
              ],
              "rewards": [
                "15 kk"
              ]
            },
            {
              "requirements": [
                "Wykonaj akcję [klawisz H] 0/500",
                "Wykonaj akcję [klawisz H] 0/1 000"
              ],
              "rewards": [
                "2 000 do max PA"
              ]
            }
          ]
        }